id,sourceUrl,name_en,name_ru,name_tg,gender,category,subCategory,tags,materialType,description_ru
item-retouched-1759510916749-48,https://raw.githubusercontent.com/davidov-robert/zto-photo/main/images/item-retouched-1759510916749-48.jpg,Embroidered Velvet National Dress,Национальное бархатное платье с вышивкой,Либоси миллии махмалин бо гулдӯзӣ,female,National Clothing,Dress,national; traditional; Tajik; velvet; blue; embroidery; silver; gold; ornate; ceremonial; elegant; festive; long dress; beads; crown,,"Элегантное национальное платье из синего бархата, украшенное изысканной серебряной и золотой вышивкой. Этот наряд, дополненный нежными бусинами и белой блузой, подчеркивает грацию и культурное наследие, идеально подходя для торжественных мероприятий."
item-retouched-1759510868675-47,https://raw.githubusercontent.com/davidov-robert/zto-photo/main/images/item-retouched-1759510868675-47.jpg,Traditional Festive Embroidered Dress,Традиционное праздничное платье с вышивкой,Либоси идонаи миллии гулдузӣ,female,National Clothing,Dress,green; gold embroidery; traditional; festive; national; ceremonial; dress; robe; wide sleeves; headpiece; long; ornate; elegant; Central Asian,,"Элегантное национальное платье насыщенного зеленого цвета, украшенное роскошной золотой вышивкой. Длинные широкие рукава и изысканный головной убор придают образу особую торжественность и величие, подчеркивая богатое культурное наследие."
item-retouched-1759510805375-43,https://raw.githubusercontent.com/davidov-robert/zto-photo/main/images/item-retouched-1759510805375-43.jpg,Elegant National Dress with Beaded Embellishments,Элегантное национальное платье с жемчужной отделкой,Либоси идонаи миллӣ бо ороиши марворидӣ,female,National Clothing,Платье,национальное платье; праздничное; торжественное; свадебное; вышивка; бисер; стразы; жемчуг; белый; серебристый; атлас; женское; длинное; традиционный; восточный; bell sleeves,,"Изысканное национальное платье, воплощающее великолепие и утонченность. Сверкающая отделка из бисера и стразов создает неповторимый блеск, а струящийся атлас подчеркивает грацию силуэта. Идеально для самых торжественных случаев."
item-retouched-1759510769331-42,https://raw.githubusercontent.com/davidov-robert/zto-photo/main/images/item-retouched-1759510769331-42.jpg,Tajik Festive National Costume,Таджикский Праздничный Национальный Костюм,Либоси миллии идонаи тоҷикӣ,female,National Clothing,Festive Costume,traditional; Tajik; national costume; festive; ceremonial; blue; white; gold embroidery; beadwork; tassels; headpiece; elegant; silk-like fabric; long dress; jacket; rich decoration,,"Изысканный таджикский национальный костюм, воплощающий величие и красоту культурного наследия. Состоит из длинного белого платья и роскошного синего жакета, обильно украшенного золотой вышивкой, бисером и кистями. Дополняет образ элегантный головной убор с перьями, делая его идеальным для торжественных событий и праздников."
item-retouched-1759510740450-41,https://raw.githubusercontent.com/davidov-robert/zto-photo/main/images/item-retouched-1759510740450-41.jpg,Oriental Festive Caftan with Embroidery,Восточный праздничный халат с вышивкой,Чодари идонаи шарқӣ бо гулдӯзӣ,female,National Clothing,Caftan,creamy; white; green; floral embroidery; beaded; traditional; festive; elegant; long sleeves; wide sleeves; headpiece; ornate; silk; national costume,,"Элегантный восточный праздничный халат кремового оттенка, богато украшенный ручной вышивкой в зеленых тонах и бисером, идеально подчеркивающий грацию и утонченность."
item-retouched-1759510706909-40,https://raw.githubusercontent.com/davidov-robert/zto-photo/main/images/item-retouched-1759510706909-40.jpg,Traditional Ceremonial Gown with Gold Embroidery,Традиционное праздничное платье с золотой вышивкой,Либоси идонаи анъанавӣ бо гулдӯзии тиллоӣ,female,National Clothing,Gown,traditional; ceremonial; national; dress; gown; green; gold; embroidery; ornate; ethnic; elegant; historical; bell sleeves; headdress; central asian; tajik,,"Изысканное традиционное платье глубокого изумрудного цвета, украшенное роскошной золотой вышивкой. Свободный крой и широкие рукава придают образу величественность, подчеркивая красоту и культурное наследие."
item-retouched-1759510663875-39,https://raw.githubusercontent.com/davidov-robert/zto-photo/main/images/item-retouched-1759510663875-39.jpg,Tajik National Costume with Gold Embroidery,Таджикский национальный костюм с золотой вышивкой,Либоси миллии тоҷикӣ бо гулдӯзии тиллоӣ,female,National Clothing,Traditional Dress,Tajik; national costume; traditional dress; embroidered; red; gold; beadwork; festive; female; kurta; vest; headpiece; Central Asian,,"Изысканный таджикский национальный костюм, состоящий из белой курта с пышными рукавами и богато украшенной красной жилетки. Золотая вышивка и бисерный декор создают роскошный образ, дополненный гармоничным головным убором. Идеально подходит для праздничных мероприятий и демонстрации культурного наследия."
item-retouched-1759510630917-38,https://raw.githubusercontent.com/davidov-robert/zto-photo/main/images/item-retouched-1759510630917-38.jpg,"Traditional Green Gown ""Emerald Queen""","Традиционное Зеленое Платье ""Изумрудная Королева""","Либоси миллии сабз ""Маликаи Зумуррад""",female,National Clothing,Ceremonial Gown,traditional dress; velvet; embroidery; silver; long sleeves; flowing; beaded fringe; ceremonial; national costume; elegant; green; white,,"Величественное традиционное платье из темно-зеленого бархата, украшенное роскошной серебряной вышивкой и сверкающей бисерной бахромой. Изящные белые рукава из легкой ткани придают образу воздушность и подчеркивают благородство наряда, идеально подходящего для торжественных событий."
item-retouched-1759510595333-37,https://raw.githubusercontent.com/davidov-robert/zto-photo/main/images/item-retouched-1759510595333-37.jpg,Tajik Traditional Festive Gown,Традиционное таджикское праздничное платье,Либоси идонаи миллии тоҷикӣ,female,National Clothing,Dress,traditional; Tajik; festive; bridal; embroidered; beaded; sequins; gold accents; champagne color; elegant; formal; headpiece; veil; dress; ornate; silk-like fabric,,"Изысканное традиционное таджикское праздничное платье, выполненное в нежном оттенке шампанского. Наряд богато украшен золотой вышивкой, бисером и пайетками, создавая поистине царственный образ. В комплекте с элегантным головным убором и прозрачной фатой, это платье идеально подходит для торжественных мероприятий и национальных свадеб, подчеркивая красоту и грацию своей обладательницы."
item-retouched-1759510558863-36,https://raw.githubusercontent.com/davidov-robert/zto-photo/main/images/item-retouched-1759510558863-36.jpg,Traditional Tajik Festive Attire,Традиционный таджикский праздничный наряд,Либоси идонаи миллии тоҷикӣ,female,National Clothing,Festive Attire,традиционный; таджикский; платье; жилет; вышивка; пайетки; праздничный; белый; черный; национальный костюм; узор икат,,"Изысканный таджикский праздничный наряд, включающий белоснежное пышное платье и элегантный длинный жилет, украшенный контрастным черно-белым узором в стиле икат и мерцающими пайетками. Этот образ воплощает вековые традиции и грацию, идеально подходя для торжественных событий."
item-retouched-1759510523783-35,https://raw.githubusercontent.com/davidov-robert/zto-photo/main/images/item-retouched-1759510523783-35.jpg,"Exquisite Tajik National Dress ""Blue Elegance""","Изысканный Таджикский Национальный Костюм ""Синяя Элегантность""","Либоси миллии тоҷикӣ ""Зебоии кабуд""",female,National Clothing,Национальный костюм,таджикский; национальный; традиционный; синий; бархат; шелк; вышивка; бусины; головной убор; женский; праздничный; культурный; элегантный; официальный,,"Величественный таджикский национальный костюм в глубоком синем цвете, символизирующий благородство и изящество. Комплект включает элегантный жакет из синего бархата с тонкой серебряной вышивкой и длинную шелковую юбку, украшенную сверкающими бусинами. Дополнен традиционным головным убором, этот наряд излучает торжественность и культурное наследие, идеально подходя для особых событий."
item-retouched-1759510495026-34,https://raw.githubusercontent.com/davidov-robert/zto-photo/main/images/item-retouched-1759510495026-34.jpg,Luxurious Embroidered National Dress with Veil,Роскошное национальное платье с вышивкой,Либоси миллии занона бо гулдӯзӣ ва рӯймол,female,National Clothing,Платье,национальное; традиционное; женское; платье; бархат; вышивка; золотой декор; стразы; бордовый; бежевый; головной убор; платок; праздничный,,"Изысканное национальное платье, выполненное из роскошного бордового бархата, украшенное богатой золотой вышивкой и сверкающими стразами. Образ дополняют струящиеся бежевые рукава, элегантный головной убор и лёгкий платок, создавая неповторимый праздничный ансамбль."
item-retouched-1759510453413-33,https://raw.githubusercontent.com/davidov-robert/zto-photo/main/images/item-retouched-1759510453413-33.jpg,"Tajik National ""Chakan"" Dress","Таджикское национальное платье ""Чакан""","Куртаи миллии ""Чакан""-и тоҷикӣ",female,National Clothing,Dress,таджикский; чакан; вышивка; орнамент; зеленый; белый; традиционный; платье; головной убор; народный; этнический; праздничный; церемониальный; длинное; национальный,pattern,"Изысканное таджикское национальное платье ""Чакан"", украшенное сложной ручной вышивкой в зеленых, белых и серых тонах. Этот величественный наряд, дополненный традиционным головным убором, воплощает глубокое культурное наследие и подходит для особых случаев, подчеркивая красоту и элегантность."
item-retouched-1759510423545-32,https://raw.githubusercontent.com/davidov-robert/zto-photo/main/images/item-retouched-1759510423545-32.jpg,Tajik Traditional Dress with Suzani Embroidery,Таджикское традиционное платье с вышивкой Сузани,Либоси миллии тоҷикӣ бо гулдӯзии сӯзанӣ,female,National Clothing,Dress,traditional; Tajik; Central Asian; embroidery; suzani; floral; blue; red; yellow; green; white; dress; ceremonial; festive; long sleeves; headscarf; cultural,,"Элегантное традиционное таджикское платье, выполненное в глубоком синем цвете и украшенное великолепной многоцветной вышивкой в технике Сузани. Яркие цветочные узоры, дополненные изящным головным убором, создают неповторимый образ, отражающий богатое культурное наследие."
item-retouched-1759510399029-31,https://raw.githubusercontent.com/davidov-robert/zto-photo/main/images/item-retouched-1759510399029-31.jpg,Exquisite Tajik Festive Gown,Изысканное таджикское вечернее платье,Либоси зебои идонаи тоҷикӣ,female,National Clothing,Dress,красный; традиционный; таджикский; вечерний; вышивка; бисер; пайетки; шелк; шифон; длинное платье; праздничный; элегантный; национальный костюм; широкие рукава; головной убор,,"Изысканное красное платье, украшенное богатой серебристой и красной вышивкой, с пышными полупрозрачными рукавами. Этот наряд воплощает в себе грацию и торжественность, идеально подходя для национальных праздников и особых случаев."
item-retouched-1759510374746-30,https://raw.githubusercontent.com/davidov-robert/zto-photo/main/images/item-retouched-1759510374746-30.jpg,Emerald Velvet Ceremonial Gown with Gold Embroidery,Изумрудное бархатное платье с золотой вышивкой,Либоси маросимии махмалини зумуррадӣ бо гулдӯзӣ,female,National Clothing,Gown,velvet; emerald green; gold embroidery; crystal embellishments; traditional; ceremonial; elegant; long dress; formal; headpiece; cultural,,"Элегантное изумрудное бархатное платье, украшенное роскошной золотой вышивкой и сверкающими кристаллами. Идеально для торжественных мероприятий и национальных праздников, подчеркивающее изысканность и величие."
item-retouched-1759510350956-29,https://raw.githubusercontent.com/davidov-robert/zto-photo/main/images/item-retouched-1759510350956-29.jpg,Festive Traditional Dress,Праздничное традиционное платье,Либоси идонаи миллӣ,female,National Clothing,Dress,белое платье; длинный рукав; традиционное; народное; этническое; праздничное; элегантное; узорчатый корсет; вышивка; головной убор; украшения; современная традиция,pattern,"Изысканное традиционное платье, сочетающее чистый белый цвет с ярким узорчатым корсетом. Идеально для праздничных мероприятий, подчеркивая грацию и национальную красоту."
item-retouched-1759510327014-28,https://raw.githubusercontent.com/davidov-robert/zto-photo/main/images/item-retouched-1759510327014-28.jpg,"Traditional ""Chakan"" Velvet Gown","Национальное платье ""Чакан"" из бархата","Либоси миллии ""Чакан"" аз махмал",female,National Clothing,Gown,velvet; embroidery; traditional; national costume; Tajik; Central Asian; ornate; long dress; gown; ceremonial; festive; elegant; floral pattern; silver; dark blue; headpiece,,"Изысканное национальное платье ""Чакан"" из глубокого синего бархата, украшенное роскошной серебряной вышивкой в виде цветочных узоров. Этот наряд, дополненный традиционным головным убором, идеально подходит для торжественных мероприятий, воплощая элегантность и культурное наследие."
item-retouched-1759510301840-27,https://raw.githubusercontent.com/davidov-robert/zto-photo/main/images/item-retouched-1759510301840-27.jpg,"Tajik National Dress ""Anor""","Таджикское национальное платье ""Анор""","Либоси миллии тоҷикӣ ""Анор""",female,National Clothing,Традиционное платье,таджикская одежда; национальное платье; вышивка; гранат; бисер; блестки; головной убор; женский; традиционный; праздничный; шелк; ручная работа,,"Изысканное таджикское национальное платье ""Анор"", украшенное богатой ручной вышивкой с узорами граната, бисером и блестками. Дополнено элегантным головным убором, оно идеально подходит для торжественных мероприятий, воплощая красоту и культурное наследие."
item-retouched-1759510280762-26,https://raw.githubusercontent.com/davidov-robert/zto-photo/main/images/item-retouched-1759510280762-26.jpg,Traditional Tajik Festive Costume,Традиционный таджикский праздничный костюм,Либоси миллии таҷрибавии тоҷикӣ,female,National Clothing,Праздничное платье,синий; белый; золотая вышивка; бисер; бахрома; нарядный; традиционный; головной убор; накидка; церемониальный,,"Элегантный таджикский праздничный костюм ярко-синего цвета с богатой золотой вышивкой и изысканной бахромой, дополненный изящным головным убором. Идеально подходит для торжественных мероприятий и национальных праздников."
item-retouched-1759510253350-25,https://raw.githubusercontent.com/davidov-robert/zto-photo/main/images/item-retouched-1759510253350-25.jpg,Tajik National Costume with Striped Dress and Embroidered Vest,Таджикский национальный костюм с полосатым платьем и жилеткой,Либоси миллии тоҷикӣ бо куртаи рах-раха ва ҷомаи гулдӯзӣ,female,National Clothing,Traditional Dress Set,striped; traditional; Tajik; national costume; embroidery; beads; fringe; velvet; long dress; headpiece; cultural; colorful; festive; Chakan,,"Изысканный таджикский национальный костюм, состоящий из длинного платья в яркую полоску и элегантной бархатной жилетки, украшенной традиционной вышивкой ""Чакан"" и бисером. Головной убор в тон завершает образ, отражая богатое культурное наследие Таджикистана."
item-retouched-1759510229229-24,https://raw.githubusercontent.com/davidov-robert/zto-photo/main/images/item-retouched-1759510229229-24.jpg,Traditional Embroidered Velvet Gown,Традиционное бархатное платье с вышивкой,Либоси миллии бархатӣ бо гулдӯзӣ,female,National Clothing,Gown,velvet;embroidery;gold accents;beads;traditional;festive;long sleeves;ruffled sleeves;headpiece;elegant;Tajik;Central Asian;gown;burgundy;cream;formal,,"Изысканное национальное платье из бархата глубокого бордового цвета, украшенное богатой золотой вышивкой и бисером. Широкие рукава из легкой ткани и элегантный головной убор дополняют образ, создавая поистине царственный и праздничный вид."
item-retouched-1759510206335-23,https://raw.githubusercontent.com/davidov-robert/zto-photo/main/images/item-retouched-1759510206335-23.jpg,Regal Purple Embroidered Gown,Царственное фиолетовое вышитое платье,Либоси арғувонии шоҳона бо гулдӯзӣ,female,National Clothing,Gown,purple;satin;silk;embroidery;silver;traditional;ceremonial;elegant;long dress;gown;formal;headpiece;earrings;national costume,,"Изысканное и величественное фиолетовое платье, украшенное сложной серебряной вышивкой, воплощает в себе роскошь и традиционную элегантность. Свободный крой и струящийся атлас создают грациозный и торжественный образ, дополненный роскошной отделкой."
item-retouched-1759510181047-22,https://raw.githubusercontent.com/davidov-robert/zto-photo/main/images/item-retouched-1759510181047-22.jpg,Emerald Embroidered National Gown,Изумрудный национальный наряд с вышивкой,Либоси миллии зумуррадӣ бо гулдӯзӣ,female,National Clothing,Gown,emerald; green; white; gold; embroidery; beads; sequins; traditional; ornate; oriental; silk; satin; flowing sleeves; long dress; ceremonial; national costume; women's fashion,,"Изысканный изумрудный национальный наряд, украшенный роскошной золотой вышивкой, бисером и пайетками, олицетворяет величие и грацию. Пышные струящиеся рукава и элегантный крой создают неповторимый образ для торжественных событий."
